<?xml version="1.0" encoding="utf-8"?>
<xs:schema xmlns:xs="http://www.w3.org/2001/XMLSchema">
    <xs:element name="users">
        <xs:complexType>
            <xs:sequence>
                <xs:element name="user" minOccurs="0" maxOccurs="unbounded">
                    <xs:complexType>
                        <xs:sequence>
                            <xs:element name="username" type="xs:string"></xs:element>
                            <xs:element name="password" type="xs:string"></xs:element>
                            <xs:element name="name" type="xs:string"></xs:element>
                            <xs:element name="email" type="xs:string"></xs:element>
                        </xs:sequence>
                        <xs:attribute name="id" type="xs:positiveInteger"></xs:attribute>
                        <xs:attribute name="type" type="xs:string"></xs:attribute>
                    </xs:complexType>
                </xs:element>
            </xs:sequence>
        </xs:complexType>
    </xs:element>
</xs:schema>